{
  "$schema": "../schemas/access-node-binding.schema.json",
  "version": "1.0.0",
  "dateCreated": "2026-06-13",
  "status": "active",
  "description": "Node access map for Balloo platform",
  "nodeGroups": {
    "A": {
      "name": "Privileged Technical Nodes",
      "description": "creator-superadmin + explicit delegated access only",
      "accessClass": "privileged",
      "defaultAccess": "creator-superadmin-only"
    },
    "B": {
      "name": "Company Internal Nodes",
      "description": "NBS-wt staff access",
      "accessClass": "internal",
      "defaultAccess": "company-staff"
    },
    "C": {
      "name": "Alpha Access Nodes",
      "description": "Alpha testing and volunteer access",
      "accessClass": "alpha",
      "defaultAccess": "alpha-volunteer"
    },
    "D": {
      "name": "Sandbox / Pre-Prod Nodes",
      "description": "Working/sandbox environment",
      "accessClass": "sandbox",
      "defaultAccess": "sandbox-operator"
    },
    "E": {
      "name": "Production Public Nodes",
      "description": "Public production surface",
      "accessClass": "public",
      "defaultAccess": "public-user"
    }
  },
  "nodes": [
    {
      "nodeId": "projectgeneralsettings.working.balloo.su",
      "canonicalHostname": "projectgeneralsettings.working.balloo.su",
      "legacyAliases": [],
      "environment": "working",
      "nodeGroup": "A",
      "accessClass": "privileged",
      "defaultAllowedRoles": ["creator-superadmin"],
      "delegatedAllowedRoles": ["delegated-node-admin"],
      "privilegedActions": [
        "access:grant:*",
        "access:revoke:*",
        "access:delegate:*",
        "role:assign:*",
        "role:revoke:*",
        "environment:bind:*",
        "system:configure:*"
      ],
      "delegatedAccessAllowed": true,
      "accessManagedBy": "projectgeneralsettings.working.balloo.su",
      "authRequired": true,
      "authLevel": "maximum",
      "publicVisible": false,
      "auditLevel": "maximum",
      "notes": "Canonical access management authority node. Highest security."
    },
    {
      "nodeId": "kodegen.working.balloo.su",
      "canonicalHostname": "kodegen.working.balloo.su",
      "legacyAliases": ["kpdegen.working.balloo.su"],
      "environment": "working",
      "nodeGroup": "A",
      "accessClass": "privileged",
      "defaultAllowedRoles": ["creator-superadmin"],
      "delegatedAllowedRoles": ["delegated-node-admin"],
      "privilegedActions": [
        "codegen:execute:*",
        "codegen:deploy:*",
        "node:switch-version:*"
      ],
      "delegatedAccessAllowed": true,
      "accessManagedBy": "projectgeneralsettings.working.balloo.su",
      "authRequired": true,
      "authLevel": "maximum",
      "publicVisible": false,
      "auditLevel": "maximum",
      "notes": "Code generation node. Legacy alias kpdegen is deprecated."
    },
    {
      "nodeId": "pilot-future.working.balloo.su",
      "canonicalHostname": "pilot-future.working.balloo.su",
      "legacyAliases": [],
      "environment": "working",
      "nodeGroup": "A",
      "accessClass": "privileged",
      "defaultAllowedRoles": ["creator-superadmin"],
      "delegatedAllowedRoles": ["delegated-node-admin"],
      "privilegedActions": [
        "system:feature-toggle:*",
        "node:deploy:*"
      ],
      "delegatedAccessAllowed": true,
      "accessManagedBy": "projectgeneralsettings.working.balloo.su",
      "authRequired": true,
      "authLevel": "maximum",
      "publicVisible": false,
      "auditLevel": "maximum",
      "notes": "Future features pilot node."
    },
    {
      "nodeId": "nodes-switcher.working.balloo.su",
      "canonicalHostname": "nodes-switcher.working.balloo.su",
      "legacyAliases": [],
      "environment": "working",
      "nodeGroup": "A",
      "accessClass": "privileged",
      "defaultAllowedRoles": ["creator-superadmin"],
      "delegatedAllowedRoles": ["delegated-node-admin"],
      "privilegedActions": [
        "node:switch-version:*",
        "environment:promote:*"
      ],
      "delegatedAccessAllowed": true,
      "accessManagedBy": "projectgeneralsettings.working.balloo.su",
      "authRequired": true,
      "authLevel": "maximum",
      "publicVisible": false,
      "auditLevel": "maximum",
      "notes": "Node version switching control."
    },
    {
      "nodeId": "workdocs.working.balloo.su",
      "canonicalHostname": "workdocs.working.balloo.su",
      "legacyAliases": [],
      "environment": "working",
      "nodeGroup": "B",
      "accessClass": "internal",
      "defaultAllowedRoles": ["creator-superadmin", "company-staff"],
      "delegatedAllowedRoles": ["delegated-node-admin"],
      "privilegedActions": [
        "docs:publish:*"
      ],
      "delegatedAccessAllowed": true,
      "accessManagedBy": "projectgeneralsettings.working.balloo.su",
      "authRequired": true,
      "authLevel": "standard",
      "publicVisible": false,
      "auditLevel": "standard",
      "notes": "Work documentation environment for NBS-wt staff."
    },
    {
      "nodeId": "admin.balloo.su",
      "canonicalHostname": "admin.balloo.su",
      "legacyAliases": [],
      "environment": "production",
      "nodeGroup": "B",
      "accessClass": "internal",
      "defaultAllowedRoles": ["creator-superadmin", "company-staff"],
      "delegatedAllowedRoles": ["delegated-node-admin"],
      "privilegedActions": [
        "system:tariff:*",
        "system:feature-toggle:*"
      ],
      "delegatedAccessAllowed": true,
      "accessManagedBy": "projectgeneralsettings.working.balloo.su",
      "authRequired": true,
      "authLevel": "standard",
      "publicVisible": false,
      "auditLevel": "standard",
      "notes": "Production admin panel for company staff."
    },
    {
      "nodeId": "alpha.balloo.su",
      "canonicalHostname": "alpha.balloo.su",
      "legacyAliases": [],
      "environment": "alpha",
      "nodeGroup": "C",
      "accessClass": "alpha",
      "defaultAllowedRoles": ["creator-superadmin", "alpha-staff", "alpha-volunteer"],
      "delegatedAllowedRoles": [],
      "privilegedActions": [],
      "delegatedAccessAllowed": false,
      "accessManagedBy": "projectgeneralsettings.working.balloo.su",
      "authRequired": true,
      "authLevel": "standard",
      "publicVisible": false,
      "auditLevel": "standard",
      "notes": "Alpha testing environment."
    },
    {
      "nodeId": "apps.alpha.balloo.su",
      "canonicalHostname": "apps.alpha.balloo.su",
      "legacyAliases": [],
      "environment": "alpha",
      "nodeGroup": "C",
      "accessClass": "alpha",
      "defaultAllowedRoles": ["creator-superadmin", "alpha-staff", "alpha-volunteer"],
      "delegatedAllowedRoles": [],
      "privilegedActions": [],
      "delegatedAccessAllowed": false,
      "accessManagedBy": "projectgeneralsettings.working.balloo.su",
      "authRequired": true,
      "authLevel": "standard",
      "publicVisible": false,
      "auditLevel": "standard",
      "notes": "Alpha applications."
    },
    {
      "nodeId": "2commands.alpha.balloo.su",
      "canonicalHostname": "2commands.alpha.balloo.su",
      "legacyAliases": [],
      "environment": "alpha",
      "nodeGroup": "C",
      "accessClass": "alpha",
      "defaultAllowedRoles": ["creator-superadmin", "alpha-staff", "alpha-volunteer"],
      "delegatedAllowedRoles": [],
      "privilegedActions": [
        "alpha:volunteer:manage"
      ],
      "delegatedAccessAllowed": false,
      "accessManagedBy": "projectgeneralsettings.working.balloo.su",
      "authRequired": true,
      "authLevel": "standard",
      "publicVisible": false,
      "auditLevel": "standard",
      "notes": "Volunteer cabinet and alpha participation requests."
    },
    {
      "nodeId": "working.balloo.su",
      "canonicalHostname": "working.balloo.su",
      "legacyAliases": [],
      "environment": "working",
      "nodeGroup": "D",
      "accessClass": "sandbox",
      "defaultAllowedRoles": ["creator-superadmin", "company-staff", "sandbox-operator"],
      "delegatedAllowedRoles": [],
      "privilegedActions": [
        "sandbox:deploy:*"
      ],
      "delegatedAccessAllowed": false,
      "accessManagedBy": "projectgeneralsettings.working.balloo.su",
      "authRequired": true,
      "authLevel": "standard",
      "publicVisible": false,
      "auditLevel": "standard",
      "notes": "Sandbox main environment."
    },
    {
      "nodeId": "api.working.balloo.su",
      "canonicalHostname": "api.working.balloo.su",
      "legacyAliases": [],
      "environment": "working",
      "nodeGroup": "D",
      "accessClass": "sandbox",
      "defaultAllowedRoles": ["creator-superadmin", "company-staff", "sandbox-operator"],
      "delegatedAllowedRoles": [],
      "privilegedActions": [],
      "delegatedAccessAllowed": false,
      "accessManagedBy": "projectgeneralsettings.working.balloo.su",
      "authRequired": true,
      "authLevel": "standard",
      "publicVisible": false,
      "auditLevel": "standard",
      "notes": "Sandbox API endpoint."
    },
    {
      "nodeId": "files.working.balloo.su",
      "canonicalHostname": "files.working.balloo.su",
      "legacyAliases": [],
      "environment": "working",
      "nodeGroup": "D",
      "accessClass": "sandbox",
      "defaultAllowedRoles": ["creator-superadmin", "company-staff", "sandbox-operator"],
      "delegatedAllowedRoles": [],
      "privilegedActions": [],
      "delegatedAccessAllowed": false,
      "accessManagedBy": "projectgeneralsettings.working.balloo.su",
      "authRequired": true,
      "authLevel": "standard",
      "publicVisible": false,
      "auditLevel": "standard",
      "notes": "Sandbox file storage."
    },
    {
      "nodeId": "docs.working.balloo.su",
      "canonicalHostname": "docs.working.balloo.su",
      "legacyAliases": [],
      "environment": "working",
      "nodeGroup": "D",
      "accessClass": "sandbox",